title,product_url,skuid,brand,category,price,price_tier,mo_sales,mo_revenue,market_share,model,oem_part_number,item_weight,weight_tier,product_dimensions,product_size_tier,amperage,amperage_tier,voltage,country_of_origin,vehicle_service_type,Type,,
hulkman alpha85 jump starter 2000 amp 20000mah car starter for up to 8.5l gas and 6l diesel engines with led display 12v lithium portable car battery booster pack (space gray),https://www.amazon.com/dp/B08M41FX48,B08M41FX48,HULKMAN,Jump Sarter,99.97,51-100$,9121,911826,4.80519084938154,,,4.44,2.1-5pound,9.06 x 4.06 x 1.81 inches,51-100sq.inch,2000 Amps,>500AMP,12 Volts,,Passenger Car,portable,,
noco boost plus gb40 1000 amp 12-volt ultrasafe lithium jump starter box car battery booster pack portable power bank charger and jumper cables for up to 6-liter gasoline and 3-liter diesel engines,https://www.amazon.com/NOCO-GB40-UltraSafe-Lithium-Starter/dp/B015TKUPIC/ref=sr_1_4?_encoding=UTF8&c=ts&dchild=1&keywords=Jump+Starters+%26+Battery+Chargers&qid=1633485755&s=automotive&sr=1-4&ts_id=387679011,B015TKUPIC,NOCO,Jump Sarter,107,101-200$,18663,1996941,10.5235896102489,GB40,,2.4,2.1-5pound,6.57 x 3.15 x 7.72 inches,101-200sq.inch,1000 Amps,>500AMP,12 Volts,,Passenger Car,portable,,
loftek portable car battery jump starter (up to 7.0l gas or 5.5l diesel engine) 12v power pack auto battery booster with built-in led light red,https://www.amazon.com/LOFTEK-Portable-Battery-Starter-Charger/dp/B08KSZSPBM/ref=sr_1_5?_encoding=UTF8&c=ts&dchild=1&keywords=Jump+Starters+%26+Battery+Chargers&qid=1633485755&s=automotive&sr=1-5&ts_id=387679011,B08KSZSPBM,LOFTEK,Jump Sarter,49.99,0-50$,2637,131824,0.694693371903051,Y29,,1.7,1.1-2pound,8.39 x 5.47 x 3.31 inches,101-200sq.inch,,,,,"Passenger Car, SUV, Truck",portable,,
stanley fatmax j7cs portable power station jump starter: 700 peak/350 instant amps 120 psi air compressor 3.1a usb ports battery clamps,https://www.amazon.com/STANLEY-FATMAX-J7CS-Jump-Starter/dp/B00RZXVQSU/ref=sr_1_6?_encoding=UTF8&c=ts&dchild=1&keywords=Jump+Starters+%26+Battery+Chargers&qid=1633485755&s=automotive&sr=1-6&ts_id=387679011,B00RZXVQSU,STANLEY,Jump Sarter,56.82,51-100$,2987,169721,0.894405068673062,J7CS,,10.25,10.1-20pound,12.5 x 11.7 x 8.5 inches,>1000sq.inch,350 Amps,201-500AMP,120 Volts,China,Passenger Car,portable,,
car battery jump starter 1500a powerful power pack car starter up to 7l gas & 5.5l diesel engine nusican 12v auto car jumper starter battery booster with qc 3.0 type c port and led flashlight,https://www.amazon.com/Nusican-Battery-Starter-18000mAh-Portable/dp/B08MFKSVX5/ref=sr_1_8?_encoding=UTF8&c=ts&dchild=1&keywords=Jump+Starters+%26+Battery+Chargers&qid=1633485755&s=automotive&sr=1-8&ts_id=387679011,B08MFKSVX5,Nusican,Jump Sarter,52.99,51-100$,1166,61786,0.32560326402174,,,2.23,2.1-5pound,6.88 x 1.6 x 3.55 inches,1-50sq.inch,1500 Amps,>500AMP,12 Volts,,"Passenger Car, Motorcycle, ATV, UTV, Truck, Snowmobile, Tractor, Trailer",non portable,,
noco boost hd gb70 2000 amp 12-volt ultrasafe lithium jump starter box car battery booster pack portable power bank charger and jumper cables for up to 8-liter gasoline and 6-liter diesel engines,https://www.amazon.com/NOCO-GB70-UltraSafe-Lithium-Gasoline/dp/B016UG6PWE/ref=sr_1_9?_encoding=UTF8&c=ts&dchild=1&keywords=Jump+Starters+%26+Battery+Chargers&qid=1633485755&s=automotive&sr=1-9&ts_id=387679011,B016UG6PWE,NOCO,Jump Sarter,199.95,101-200$,5074,1014546,5.34651035995534,GB70,,5,2.1-5pound,6 x 2.5 x 8.6 inches,101-200sq.inch,2000 Amps,>500AMP,12 Volts,China,Passenger Car,portable,,
dewalt dxaej14 digital portable power station jump starter: 1400 peak/700 instant amps 120 psi digital air compressor 3.1a usb ports battery clamps,https://www.amazon.com/DEWALT-DXAEJ14-Jump-Starter-Compressor/dp/B06XD6XBCM/ref=sr_1_10?_encoding=UTF8&c=ts&dchild=1&keywords=Jump+Starters+%26+Battery+Chargers&qid=1633485755&s=automotive&sr=1-10&ts_id=387679011,B06XD6XBCM,DEWALT,Jump Sarter,159,101-200$,1261,200499,1.05660066735336,DXAEJ14,,1,0-1pound,11.75 x 6 x 13 inches,501-1000sq.inch,1400 Amps,>500AMP,12 Volts,China,Passenger Car,portable,,
dbpower 800a 18000mah portable car jump starter (up to 7.2l gas 5.5l diesel engine) battery booster with smart charging port compass lcd screen and led light (black/red),https://www.amazon.com/DBPOWER-18000mAh-Portable-Starter-Charging/dp/B01D42TYFC/ref=sr_1_11?_encoding=UTF8&c=ts&dchild=1&keywords=Jump+Starters+%26+Battery+Chargers&qid=1633485755&s=automotive&sr=1-11&ts_id=387679011,B01D42TYFC,DBPOWER,Jump Sarter,74.99,51-100$,2158,161828,0.852810102775875,DJS50,,2.82,2.1-5pound,7.28 x 1.57 x 3.54 inches,1-50sq.inch,800 Amps,>500AMP,12 Volts,,"Car, Truck, UTV, Motorcycle, Truck, Snowmobile, boat, lawn mover, Personal Watercraft, Track, Trailer, Cellphone, Laptop, Tablet, Car refrigerator , Car vacuum cleaner, car air pump",portable,,
imazing portable car jump starter - 2000a peak 18000mah (up to 10l gas or 8l diesel engine) 12v auto battery booster portable power pack with lcd display jumper cables qc 3.0 and led light,https://www.amazon.com/Imazing-Portable-Car-Jump-Starter/dp/B07T49JQBR/ref=sr_1_13?_encoding=UTF8&c=ts&dchild=1&keywords=Jump+Starters+%26+Battery+Chargers&qid=1633485755&s=automotive&sr=1-13&ts_id=387679011,B07T49JQBR,Imazing,Jump Sarter,59.49,51-100$,4335,257889,1.35903764858225,IM27,,2.25,2.1-5pound,9.57 x 5.31 x 4.09 inches,2011-500sq.inch,2000 Amps,>500AMP,12 Volts,,"Car, Truck, UTV, Motorcycle, Dirt Bike,Personal Watercraft, RV or tractor",portable,,
stanley j5c09 portable power station jump starter: 1000 peak/500 instant amps- 120 psi air compressor- usb port- battery clamps,https://www.amazon.com/STANLEY-J5C09-Jump-Starter-Compressor/dp/B002X6VXL4/ref=sr_1_14?_encoding=UTF8&c=ts&dchild=1&keywords=Jump+Starters+%26+Battery+Chargers&qid=1633485755&s=automotive&sr=1-14&ts_id=387679011,B002X6VXL4,STANLEY,Jump Sarter,112.34,101-200$,3450,387573,2.04245353068168,J5C09,,18,10.1-20pound,11.25 x 8 x 13.5 inches,>1000sq.inch,500 Amps,201-500AMP,12 Volts,China,Passenger Car,portable,,
noco boost x gbx155 4250a 12v ultrasafe portable lithium jump starter car battery booster pack usb-c powerbank charger and jumper cables for up to 10.0-liter gas and 8.0-liter diesel engines,https://www.amazon.com/NOCO-GBX155-UltraSafe-Powerbank-10-0-Liter/dp/B08WZFPXFM/ref=sr_1_15?_encoding=UTF8&c=ts&dchild=1&keywords=Jump+Starters+%26+Battery+Chargers&qid=1633485755&s=automotive&sr=1-15&ts_id=387679011,B08WZFPXFM,NOCO,Jump Sarter,349.95,201-400$,1384,484331,2.5523541654568,GBX155,,7.01,5.1-10pound,8.18 x 4.84 x 13.51 inches,501-1000sq.inch,500 Amps,201-500AMP,12 Volts,China,"Passenger Car, Motorcycle, Van, ATV, SUV, Truck, Tractor",portable,,
car battery jump starter portable - 600a peak waterproof 12v portable battery booster pack (up to 4.0l gas or 2.0l diesel engine) safe auto power bank with usb port smart clamps & led flashlight,https://www.amazon.com/Car-Battery-Jump-Starter-Portable/dp/B07TD4NQR9/ref=sr_1_16?_encoding=UTF8&c=ts&dchild=1&keywords=Jump+Starters+%26+Battery+Chargers&qid=1633485755&s=automotive&sr=1-16&ts_id=387679011,B07TD4NQR9,Vekkia,Jump Sarter,41.99,0-50$,1038,43586,0.229691902140478,,,1.35,1.1-2pound,5.52 x 3.35 x 0.99 inches,1-50sq.inch,600 Amps,>500AMP,12 Volts,,ATV,portable,,
car jump starter sun pow 2000a peak 20000mah lithium jump starter pack(up to all gas and 8.5l diesel)12v battery booster for cars trucks suv portable power pack with lcd screen & led light,https://www.amazon.com/Starter-SUNPOW-20000mAh-Lithium-Portable/dp/B08MTJFGDW/ref=sr_1_18?_encoding=UTF8&c=ts&dchild=1&keywords=Jump+Starters+%26+Battery+Chargers&qid=1633485755&s=automotive&sr=1-18&ts_id=387679011,B08MTJFGDW,SUN P O W,Jump Sarter,95.99,51-100$,1007,96662,0.509394728690472,,,2,1.1-2pound,4 x 2 x 9 inches,51-100sq.inch,2000 Amps,>500AMP,12 Volts,,"Passenger Car, Van, Motorcycle, Lawn-mower, Yacht, SUV, Truck, Watercraft, Snowmobile",portable,,
nexpow car battery starter 1500a peak 21800mah 12v portable car jump starter auto battery booster lithium jump box with led light/quick charge 3.0,https://www.amazon.com/NEXPOW-Battery-Starter-21800mAh-Charge/dp/B07T9S3Q5N/ref=sr_1_19?_encoding=UTF8&c=ts&dchild=1&keywords=Jump+Starters+%26+Battery+Chargers&qid=1633485755&s=automotive&sr=1-19&ts_id=387679011,B07T9S3Q5N,NEXPOW,Jump Sarter,69.99,51-100$,1227,85878,0.452564611848299,,,2.68,2.1-5pound,9 x 3.4 x 1.2 inches,1-50sq.inch,1500 Amps,>500AMP,12 Volts,,"Passenger Car, Motorcycle, ATV, UTV, Truck, Snowmobile",portable,,
nexpow 2000a peak 18000mah car jump starter with usb quick charge 3.0 (up to 7.0l gas or 6.5l diesel engine) 12v portable battery starter battery booster with built-in led light,https://www.amazon.com/NEXPOW-18000mAh-Starter-Portable-Battery/dp/B087LRFYDB/ref=sr_1_20?_encoding=UTF8&c=ts&dchild=1&keywords=Jump+Starters+%26+Battery+Chargers&qid=1633485755&s=automotive&sr=1-20&ts_id=387679011,B087LRFYDB,NEXPOW,Jump Sarter,79.98,51-100$,1349,107893,0.568580470739288,,,2.59,2.1-5pound,9 x 3.4 x 1.2 inches,1-50sq.inch,2000 Amps,>500AMP,12 Volts,,"Passenger Car, Motorcycle, ATV, UTV, Truck, Snowmobile",portable,,
noco boost xl gb50 1500 amp 12-volt ultrasafe lithium jump starter box car battery booster pack portable power bank charger and jumper cables for up to 7-liter gasoline and 4-liter diesel engines,https://www.amazon.com/NOCO-GB50-UltraSafe-Lithium-Gasoline/dp/B07MVY7K43/ref=sr_1_21?_encoding=UTF8&c=ts&dchild=1&keywords=Jump+Starters+%26+Battery+Chargers&qid=1633485755&s=automotive&sr=1-21&ts_id=387679011,B07MVY7K43,NOCO,Jump Sarter,151.08,101-200$,1590,240217,1.26590877016655,GB50,,1.65,1.1-2pound,7.7 x 3.4 x 1.9 inches,1-50sq.inch,1500 Amps,>500AMP,12 Volts,China,Passenger Car,portable,,
noco boost x gbx75 2500a 12v ultrasafe portable lithium jump starter car battery booster pack usb-c powerbank charger and jumper cables for up to 8.5-liter gas and 6.5-liter diesel engines,https://www.amazon.com/NOCO-GBX75-UltraSafe-Powerbank-8-5-Liter/dp/B08WYKD6TY/ref=sr_1_23?_encoding=UTF8&c=ts&dchild=1&keywords=Jump+Starters+%26+Battery+Chargers&qid=1633485755&s=automotive&sr=1-23&ts_id=387679011,B08WYKD6TY,NOCO,Jump Sarter,249.95,201-400$,728,181964,0.95892390403088,GBX75,,5,2.1-5pound,7.28 x 4.84 x 9.8 inches,2011-500sq.inch,2500 Amps,>500AMP,12 Volts,China,"Passenger Car, Van, Motorcycle, ATV, SUV, Truck, Tractor",portable,,
noco boost x gbx45 1250a 12v ultrasafe portable lithium jump starter car battery booster pack usb-c powerbank charger and jumper cables for up to 6.5-liter gas and 4.0-liter diesel engines,https://www.amazon.com/NOCO-GBX45-UltraSafe-Powerbank-6-5-Liter/dp/B0924V8SPC/ref=sr_1_24?_encoding=UTF8&c=ts&dchild=1&keywords=Jump+Starters+%26+Battery+Chargers&qid=1633485755&s=automotive&sr=1-24&ts_id=387679011,B0924V8SPC,NOCO,Jump Sarter,124.95,101-200$,1986,248151,1.30771980012072,GBX45,,2.75,2.1-5pound,3.62 x 4.96 x 8.23 inches,101-200sq.inch,1250 Amps,>500AMP,12 Volts,China,"Passenger Car, Motorcycle, Van, ATV, SUV, Truck, Tractor",portable,,
foxpeed 2500a car jump starter 21000mah 12v car battery charger jump starter (up to 8l gas 6.5l diesel engine) with lcd dispaly usb quick charge type c port & sturdy case portable battery booster,https://www.amazon.com/Foxpeed-Battery-21000mAh-Portable-Flashlight/dp/B08D39YZPQ/ref=sr_1_25?_encoding=UTF8&c=ts&dchild=1&keywords=Jump+Starters+%26+Battery+Chargers&qid=1633485755&s=automotive&sr=1-25&ts_id=387679011,B08D39YZPQ,FOXPEED,Jump Sarter,69.99,51-100$,1494,104565,0.551042393138143,G29,,2.64,2.1-5pound,9.72 x 5.28 x 4.25 inches,2011-500sq.inch,2500 Amps,>500AMP,12 Volts,,"Passenger Car, Van, SUV, Truck",portable,,
schumacher battery charger with engine starter boost and maintainer - 200 amp/40 amp 6v/12v - for cars trucks suvs marine rv batteries,https://www.amazon.com/Schumacher-SC1309-Battery-Charger-Maintainer/dp/B0756MDZ1F/ref=sr_1_26?_encoding=UTF8&c=ts&dchild=1&keywords=Jump+Starters+%26+Battery+Chargers&qid=1633485755&s=automotive&sr=1-26&ts_id=387679011,B0756MDZ1F,Schumacher,Jump Sarter,158.39,101-200$,340,53853,0.283797503922617,SC1309,,29.9,20.1-40pound,31 x 12 x 12 inches,>1000sq.inch,200 Amps,101-200AMP,,Mexico,,non portable,,
gooloo jump starter battery pack - 1500a peak jump boxwater-resistant car battery booster for up to 8.0l gas or 6.0l diesel engines12v car jumper starter portable with qc 3.0type c port,https://www.amazon.com/GOOLOO-SuperSafe-Starter-Portable-Resistant/dp/B08CC1GYR1/ref=sr_1_27?_encoding=UTF8&c=ts&dchild=1&keywords=Jump+Starters+%26+Battery+Chargers&qid=1633485755&s=automotive&sr=1-27&ts_id=387679011,B08CC1GYR1,GOOLOO,Jump Sarter,69.99,51-100$,1479,103515,0.545509045337301,Car Jump Starter,,2.57,2.1-5pound,7.4 x 3.66 x 1.39 inches,1-50sq.inch,1500 Amps,>500AMP,12 Volts,,"ATV, UTV, Dirt Bike, Snowmobile, Adventure, Personal Watercraft",portable,,
halo bolt 58830 mwh portable phone laptop charger car jump starter with ac outlet and car charger - silver graphite (1267118),https://www.amazon.com/Portable-Laptop-Charger-Starter-Outlet/dp/B0829FTQVF/ref=sr_1_28?_encoding=UTF8&c=ts&dchild=1&keywords=Jump+Starters+%26+Battery+Chargers&qid=1633485755&s=automotive&sr=1-28&ts_id=387679011,B0829FTQVF,Halo,Jump Sarter,99.99,51-100$,2340,233977,1.2330248746644,,,2.86,2.1-5pound,7.2 x 3.8 x 1.6 inches,1-50sq.inch,,,,China,,portable,,
schumacher rechargeable agm jump starter for gas diesel vehicles - 1200 amps with air compressor and ac 12v dc usb power station,https://www.amazon.com/Schumacher-SJ1332-Jump-Starter/dp/B07892JQ1Q/ref=sr_1_29?_encoding=UTF8&c=ts&dchild=1&keywords=Jump+Starters+%26+Battery+Chargers&qid=1633485755&s=automotive&sr=1-29&ts_id=387679011,B07892JQ1Q,Schumacher,Jump Sarter,149.99,101-200$,1103,165439,0.871839549355723,SJ1332,,19.16,10.1-20pound,14 x 13 x 13 inches,>1000sq.inch,1200 Amps,>500AMP,120 Volts,Mexico,Passenger Car,non portable,,
acetek 1200 amp car jump starter portable battery charger 20000mah emergency supply power pack (up to 6l gas or 6l diesel engine) 12v auto lead-acid battery booster with led light & usb ports,https://www.amazon.com/Starter-Emergency-20000mAh-Portable-Lead-acid/dp/B083JZS6L4/ref=sr_1_30?_encoding=UTF8&c=ts&dchild=1&keywords=Jump+Starters+%26+Battery+Chargers&qid=1633485755&s=automotive&sr=1-30&ts_id=387679011,B083JZS6L4,acetek,Jump Sarter,129.99,101-200$,351,45626,0.240442406439257,,,17.4,10.1-20pound,10 x 5 x 11 inches,501-1000sq.inch,1200 Amps,>500AMP,12 Volts,,"Passenger Car, Motorcycle, SUV",portable,,
halo bolt compact portable car jump starter - car battery jump starter with 2 usb ports to charger devices portable car charger - gold marble,https://www.amazon.com/HALO-Bolt-Compact-Portable-Starter/dp/B088VSMF7Z/ref=sr_1_27?_encoding=UTF8&c=ts&dchild=1&keywords=Jump+Starters+%26+Battery+Chargers&qid=1633486070&s=automotive&sr=1-27&ts_id=387679011,B088VSMF7Z,Halo,Jump Sarter,75.13,51-100$,660,49586,0.261311032431004,,,1.14,1.1-2pound,6.1 x 3.35 x 1.46 inches,1-50sq.inch,,,,China,,portable,,
clore automotive jump-n-carry jnc660 1700 peak amp 12 volt jump starter  blue,https://www.amazon.com/Clore-Automotive-Jump-N-Carry-JNC660-Starter/dp/B000JFJLP6/ref=sr_1_28?_encoding=UTF8&c=ts&dchild=1&keywords=Jump+Starters+%26+Battery+Chargers&qid=1633486070&s=automotive&sr=1-28&ts_id=387679011,B000JFJLP6,Clore Automotive,Jump Sarter,148.02,101-200$,4347,643443,3.39085134192116,1700 Peak Amp 12 Volt Jump Starter,,18,10.1-20pound,16.3 x 14.1 x 5.1 inches,>1000sq.inch,1700 Amps,>500AMP,12 Volts,China,Passenger Car,non portable,,
biuble car battery starter 1000a peak 12800mah 12v car auto jump starter power pack with usb quick charge 3.0 (up to 7l gas or 5.5l diesel engine) (1000a),https://www.amazon.com/BIUBLE-Battery-Starter-12800mAh-Charge/dp/B08GYFP5JK/ref=sr_1_29?_encoding=UTF8&c=ts&dchild=1&keywords=Jump+Starters+%26+Battery+Chargers&qid=1633486070&s=automotive&sr=1-29&ts_id=387679011,B08GYFP5JK,BIUBLE,Jump Sarter,42.99,0-50$,1071,46042,0.2426346661394,,,1.76,1.1-2pound,6.69 x 3.15 x 1.18 inches,1-50sq.inch,1000 Amps,>500AMP,12 Volts,,Passenger Car,non portable,,
car jump starter  2000a jump box 20000mah for up to 10l gas and 5.5l diesel engines 12v car battery charger jump starter with usb/type c quick charge portable power bank with led display and light,https://www.amazon.com/Car-Jump-Starter-20000mAh-Portable/dp/B096LW1638/ref=sr_1_30?_encoding=UTF8&c=ts&dchild=1&keywords=Jump+Starters+%26+Battery+Chargers&qid=1633486070&s=automotive&sr=1-30&ts_id=387679011,B096LW1638,Lurxay,Jump Sarter,69.99,51-100$,333,23307,0.122824511613548,,,2.68,2.1-5pound,10.94 x 5.87 x 4.37 inches,2011-500sq.inch,2000 Amps,>500AMP,,,Passenger Car,portable,,
fanttik t8 apex jump starter 2000 amp portable jump starter for up to 8.5l gas and 6l diesel engines digital screen 65w two-way fast charging 12v car battery booster,https://www.amazon.com/dp/B09CTJMLQP,B09CTJMLQP,Fanttik,Jump Sarter,129.97,101-200$,1613,209642,1.10478295206108,T8 APEX,,4.6,2.1-5pound,9.21 x 3.74 x 1.77 inches,51-100sq.inch,2000 Amps,>500AMP,12 Volts,,Passenger Car,portable,,
booster pac es5000 1500 peak amp 12v jump starter,https://www.amazon.com/Booster-ES5000-1500-Peak-Starter/dp/B000JFHNQA/ref=sr_1_32?_encoding=UTF8&c=ts&dchild=1&keywords=Jump+Starters+%26+Battery+Chargers&qid=1633486070&s=automotive&sr=1-32&ts_id=387679011,B000JFHNQA,Clore Automotive,Jump Sarter,127.24,101-200$,1313,167066,0.880413603519504,,,18,10.1-20pound,18.3 x 11.4 x 4.4 inches,501-1000sq.inch,1500 Amps,>500AMP,12 Volts,,,non portable,,
suhu car battery charger 12v/8a 24v/4a smart automatic battery charger maintainer trickle charger for car truck motorcycle lawn mower boat marine rv suv atv sla wet agm gel cell lead acid battery,https://www.amazon.com/SUHU-Battery-Automatic-Automotive-Motorcycle/dp/B08GRRRNCK/ref=sr_1_33?_encoding=UTF8&c=ts&dchild=1&keywords=Jump+Starters+%26+Battery+Chargers&qid=1633486070&s=automotive&sr=1-33&ts_id=387679011,B08GRRRNCK,SUHU,Jump Sarter,29.99,0-50$,1476,44265,0.233270133718356,,,1.23,1.1-2pound,9.06 x 5.12 x 2.36 inches,101-200sq.inch,8,0-20AMP,,,,non portable,,
noco genius1 1-amp fully-automatic smart charger 6v and 12v battery charger battery maintainer trickle charger and battery desulfator with temperature compensation,https://www.amazon.com/NOCO-GENIUS1-Fully-Automatic-Temperature-Compensation/dp/B07W46BX31/ref=sr_1_34?_encoding=UTF8&c=ts&dchild=1&keywords=Jump+Starters+%26+Battery+Chargers&qid=1633486070&s=automotive&sr=1-34&ts_id=387679011,B07W46BX31,NOCO,Jump Sarter,29.95,0-50$,12596,377250,1.98805281701683,GENIUS1,,0.76875,0-1pound,3.5 x 2.3 x 1.3 inches,1-50sq.inch,,,,China,,non portable,,
noco boost pro gb150 3000 amp 12-volt ultrasafe lithium jump starter box car battery booster pack portable power bank charger and jumper cables for up to 9-liter gasoline and 7-liter diesel engines,https://www.amazon.com/dp/B015TKSSB8,B015TKSSB8,NOCO,Jump Sarter,299.95,201-400$,1454,436127,2.29832607270271,GB150,GB150,7.5,5.1-10pound,16.85 x 9.21 x 4.02 inches,501-1000sq.inch,3000 Amps,>500AMP,12 Volts,China,Passenger Car,portable,,
stanley j509 portable power station jump starter: 1000 peak/500 instant amps usb port battery clamps,https://www.amazon.com/STANLEY-J509-Jump-Starter-Instant/dp/B003ZYS8UW/ref=sr_1_36?_encoding=UTF8&c=ts&dchild=1&keywords=Jump+Starters+%26+Battery+Chargers&qid=1633486070&s=automotive&sr=1-36&ts_id=387679011,B003ZYS8UW,STANLEY,Jump Sarter,70.61,51-100$,583,41166,0.216938852923299,J509,,16.2,10.1-20pound,11.25 x 6.75 x 13.5 inches,>1000sq.inch,1000 Amps,>500AMP,12 Volts,China,Passenger Car,portable,,
autogen 4000 amp 32000mah lithium car jump starter (10.0l+ gas & diesel) 12v battery jumper box booster pack usb quick charge 3.0 charger portable power pack for cars suvs trucks,https://www.amazon.com/AUTOGEN-Starter-Diesel-Portable-Trucks/dp/B07KZSBLS4/ref=sr_1_37?_encoding=UTF8&c=ts&dchild=1&keywords=Jump+Starters+%26+Battery+Chargers&qid=1633486070&s=automotive&sr=1-37&ts_id=387679011,B07KZSBLS4,AUTOGEN,Jump Sarter,189.98,101-200$,484,91950,0.484563171702312,,,4.15,2.1-5pound,9.33 x 3.74 x 1.69 inches,51-100sq.inch,4000 Amps,>500AMP,12 Volts,,"Passenger Car, SUV, Truck",portable,,
diehard 71326 6/12v gold shelf smart battery charger and 12/80a engine starter  black,https://www.amazon.com/DieHard-71326-Battery-Charger-Starter/dp/B07777DLBX/ref=sr_1_38?_encoding=UTF8&c=ts&dchild=1&keywords=Jump+Starters+%26+Battery+Chargers&qid=1633486070&s=automotive&sr=1-38&ts_id=387679011,B07777DLBX,DieHard,Jump Sarter,89.99,51-100$,226,20338,0.107178311974786,,,13.35,10.1-20pound,10 x 5.88 x 10.88 inches,501-1000sq.inch,80,51-100AMP,12 Volts,Mexico,Passenger Car,non portable,,
gooloo car jump starter1500a 12-volt lithium battery booster for up to 8.0l gas & 6.0l diesel enginesportable water-resistant car battery charger jump box with usb quick charge & type-c portyellow,https://www.amazon.com/GOOLOO-Starter-12-Volt-Portable-Water-Resistant/dp/B08V8BLJLL/ref=sr_1_41?_encoding=UTF8&c=ts&dchild=1&keywords=Jump+Starters+%26+Battery+Chargers&qid=1633486070&s=automotive&sr=1-41&ts_id=387679011,B08V8BLJLL,GOOLOO,Jump Sarter,79.99,51-100$,1254,100307,0.528603350341966,Portable jump starter,,2.55,2.1-5pound,7.4 x 3.66 x 1.39 inches,1-50sq.inch,1500 Amps,>500AMP,12 Volts,,"Passenger Car, Motorcycle, Van, ATV, UTV, Truck, Snowmobile",portable,,
gooloo jump starter battery pack 1200a peak 18000mah supersafe car starter (up to 7.0l gas or 5.5l diesel engine) with usb quick charge and led light12v lithium jump box booster portable chargergray,https://www.amazon.com/dp/B08CXMS19H,B08CXMS19H,GOOLOO,Jump Sarter,69.99,51-100$,1633,114294,0.602312812904231,Jump starter,,2.66,2.1-5pound,6.18 x 2.95 x 1.42 inches,1-50sq.inch,1200 Amps,>500AMP,12 Volts,,"ATV, UTV, Dirt Bike, Snowmobile, Adventure, Personal Watercraft",portable,,
sanrock car battery starter 2500a peak 22800mah jump starter for cars trucks and suv(up to 8l gas/8l diesel engine) 12v auto battery booster jump pack with type-c usb quick charge 3.0 and led light,https://www.amazon.com/SANROCK-Battery-Starter-22800mAh-Flashlight/dp/B08FDV18LW/ref=sr_1_43?_encoding=UTF8&c=ts&dchild=1&keywords=Jump+Starters+%26+Battery+Chargers&qid=1633486070&s=automotive&sr=1-43&ts_id=387679011,B08FDV18LW,SANROCK,Jump Sarter,69.99,51-100$,148,10359,0.054590428446593,TC2000,,1.2,1.1-2pound,6.68 x 3.54 x 1.97 inches,1-50sq.inch,2500 Amps,>500AMP,12 Volts,,"Car, Truck, UTV, Motorcycle, Dirt Bike,Personal Watercraft, RV or tractor",non portable,,
aizico portable car jump starter 2500a peak 22800mah battery booster for cars trucks and suv(up to 8l gas/diesel engine) 12v auto battery jump pack with type-c usb quick charge 3.0 and led light,https://www.amazon.com/AIZICO-Portable-Starter-22800mAh-Battery/dp/B095K2C8TG/ref=sr_1_45?_encoding=UTF8&c=ts&dchild=1&keywords=Jump+Starters+%26+Battery+Chargers&qid=1633486070&s=automotive&sr=1-45&ts_id=387679011,B095K2C8TG,AIZICO,Jump Sarter,69.98,51-100$,353,24703,0.130181229261144,,,1.37,1.1-2pound,6.69 x 3.74 x 2.03 inches,51-100sq.inch,2500,>500AMP,,,"Passenger Car, SUV, Truck",portable,,
biuble car jump starter 2500a peak 24000mah (up to all gas or 8.0l diesel engine 50 times) 12v auto booster battery pack jump box with 10w wireless charger smart jump cables,https://www.amazon.com/BIUBLE-Starter-24000mAh-Booster-Wireless/dp/B08TVV2L5C/ref=sr_1_46?_encoding=UTF8&c=ts&dchild=1&keywords=Jump+Starters+%26+Battery+Chargers&qid=1633486070&s=automotive&sr=1-46&ts_id=387679011,B08TVV2L5C,BIUBLE,Jump Sarter,67.98,51-100$,410,27872,0.14688139990959,,,2.87,2.1-5pound,7.28 x 3.62 x 1.69 inches,1-50sq.inch,2500 Amps,>500AMP,12 Volts,,"Passenger Car, Truck",non portable,,
hulkman alpha85s with -40 preheat tech smart portable jump starter with alpha bag eva protection case,https://www.amazon.com/HULKMAN-Alpha85S-Preheat-Portable-Protection/dp/B0978M6FXN/ref=sr_1_47?_encoding=UTF8&c=ts&dchild=1&keywords=Jump+Starters+%26+Battery+Chargers&qid=1633486070&s=automotive&sr=1-47&ts_id=387679011,B0978M6FXN,HULKMAN,Jump Sarter,129.99,101-200$,408,53036,0.279492032348057,,,,,,,2000 Amps,>500AMP,,,Passenger Car,portable,,
nekteck portable car jump starter 19800mah 2000a peak car battery jump starter(up to 10l gas or 7l diesel engines) 15v auto battery booster pack usb quick charger 3.0 ul 2743(sgs certified),https://www.amazon.com/Nekteck-19800mAh-Portable-Intelligent-Certified/dp/B083F8YRTC/ref=sr_1_48?_encoding=UTF8&c=ts&dchild=1&keywords=Jump+Starters+%26+Battery+Chargers&qid=1633486070&s=automotive&sr=1-48&ts_id=387679011,B083F8YRTC,Nekteck,Jump Sarter,53.99,51-100$,422,22784,0.120068377423224,,,2.7,2.1-5pound,8.85 x 3.5 x 1.1 inches,1-50sq.inch,2000 Amps,>500AMP,15 Volts,,"Passenger Car, Motorcycle, ATV, Tractor",portable,,
avapow car jump starter 4000a peak 27800mah battery jump starter (for all gas or up to 10l diesel) battery booster power pack 12v auto jump box with led light usb quick charge 3.0,https://www.amazon.com/AVAPOW-Starter-27800mAh-Battery-Booster/dp/B0928VN98C/ref=sr_1_49?_encoding=UTF8&c=ts&dchild=1&keywords=Jump+Starters+%26+Battery+Chargers&qid=1633486070&s=automotive&sr=1-49&ts_id=387679011,B0928VN98C,AVAPOW,Jump Sarter,109.99,101-200$,879,96681,0.509494855936392,,,3.58,2.1-5pound,10.24 x 5.91 x 5.04 inches,2011-500sq.inch,4000 Amps,>500AMP,,,Passenger Car,non portable,,
battery starter for car topvision 2200a peak 21800mah portable car jump starter (up to 7.0l gas or 6.5l diesel engine) 12v portable battery booster,https://www.amazon.com/TOPVISION-2200A-Peak-Car-Power/dp/B07H58NP77/ref=sr_1_50?_encoding=UTF8&c=ts&dchild=1&keywords=Jump+Starters+%26+Battery+Chargers&qid=1633486070&s=automotive&sr=1-50&ts_id=387679011,B07H58NP77,T TOPVISION,Jump Sarter,79.99,51-100$,4625,369954,1.94960395458355,,,1.56,1.1-2pound,7.7 x 3.5 x 1.6 inches,1-50sq.inch,2200 Amps,>500AMP,12 Volts,,"Passenger Car, Motorcycle, Truck, Watercraft, Tractor, Trailer",portable,,
